{
  "blocks": {},
  "description": "A minimal valid pack used for Phase 14 pack_trust fixtures.",
  "domain_module": "programming",
  "edges": [],
  "exportVersion": "0.1.0",
  "exportedAt": "2026-07-09T00:00:00Z",
  "exportedFrom": "licensed:test-pack|Test Publisher",
  "id": "test-pack",
  "labs": {},
  "modules": [],
  "signature": {
    "alg": "ed25519",
    "issuerCert": {
      "issuerId": "test-publisher",
      "name": "Test Publisher",
      "publicKeyPem": "-----BEGIN PUBLIC KEY-----\nMCowBQYDK2VwAyEAoDTcVvgodH0q4fclQMPjv5E6POrfi/JYdKrwG3f0yng=\n-----END PUBLIC KEY-----",
      "rootSig": "ae1613e932b803c488d9220ce44b59ab521b2a8a99e7a42cd2818120cf1f86018d14684a2983419889487194b63079b445c0b580cae9f5aa3ff0808d130d1009"
    },
    "keyFingerprint": "a88f6ecd",
    "sig": "422e45ccdb06f20e70d8c6c624cc35c6422928238cc0e78101249065dfd4503b4865708878e360f33cf2c0e97165901433388320f686ab64ee21f501f65ef50c"
  },
  "title": "Signed Test Pack",
  "videos": {}
}