{
  "blocks": {},
  "description": "A minimal valid pack used for Phase 14 pack_trust fixtures.",
  "domain_module": "programming",
  "edges": [],
  "exportVersion": "0.1.0",
  "exportedAt": "2026-07-09T00:00:00Z",
  "exportedFrom": "licensed:test-pack|Test Publisher",
  "id": "test-pack",
  "labs": {},
  "modules": [
    {
      "description": "First module.",
      "difficulty": 1,
      "estimatedMinutes": 30,
      "id": "mod-one",
      "objectives": [
        "learn basics"
      ],
      "title": "Module One"
    }
  ],
  "title": "Signed Test Pack",
  "videos": {}
}